{
  "$schema": "http://json-schema.org/draft-07/schema#",
  "type": "object",
  "properties": {
    "namespace": {
      "type": "string",
      "title": "Namespace"
    },
    "replicaCount": {
      "type": "integer",
      "title": "Replica Count"
    },
    "image": {
      "type": "object",
      "properties": {
        "repository": { "type": "string" },
        "pullPolicy": { "type": "string" },
        "tag": { "type": "string" }
      }
    },
    "service": {
      "type": "object",
      "properties": {
        "type": { "type": "string" },
        "port": { "type": "integer" },
        "containerPort": { "type": "integer" }
      }
    },
    "server_name": {
      "type": "string",
      "title": "Server Name"
    },
    "ingress": {
      "type": "object",
      "properties": {
        "enabled": { "type": "boolean" },
        "className": { "type": "string" },
        "annotations": {
          "type": "object",
          "additionalProperties": { "type": "string" }
        },
        "hosts": {
          "type": "array",
          "items": {
            "type": "object",
            "properties": {
              "host": { "type": "string" },
              "paths": {
                "type": "array",
                "items": {
                  "type": "object",
                  "properties": {
                    "path": { "type": "string" },
                    "pathType": { "type": "string" }
                  }
                }
              }
            }
          }
        },
        "tls": {
          "type": "array",
          "items": {
            "type": "object",
            "properties": {
              "secretName": { "type": "string" },
              "hosts": {
                "type": "array",
                "items": { "type": "string" }
              }
            }
          }
        }
      }
    }
  }
}
